{
  "schema_version": 1,
  "profile_id": "dotmac-governance",
  "repository_name": "dotmac_governance",
  "summary": "Organization-wide governance records and validation for Dotmac engineering.",
  "canonical_repository": "https://github.com/michaelayoade/dotmac_governance",
  "default_branch": "main",
  "governance_model": {
    "version": "0.1.0",
    "source": "docs/adr/0005-agent-bootstrap-conformance-control-plane.md",
    "status": "accepted"
  },
  "instructions": {
    "agents_path": "AGENTS.md",
    "claude_path": "CLAUDE.md",
    "claude_import": "@AGENTS.md",
    "render_mode": "validate",
    "max_combined_bytes": 32768,
    "warn_combined_bytes": 24576,
    "required_agents_markers": [
      "# Agent constraints",
      "## Authority and status",
      "## Required workflow",
      "## Reporting"
    ],
    "required_claude_markers": [
      "# Claude-specific additions"
    ],
    "authoritative_sources": [
      ".dotmac/validation-contract.json",
      "README.md",
      "docs/adr/0001-governance-authority-model.md",
      "docs/adr/README.md",
      "docs/agent-client-contracts.md",
      "docs/agent-guidance/global.md",
      "docs/agent-guidance/claude-user.md",
      "docs/open-decisions.md"
    ],
    "claude_additions": [
      "Treat every Proposed ADR and draft policy as non-normative.",
      "Use the same checked-in validation commands as Codex.",
      "Keep shared governance instructions in AGENTS.md."
    ]
  },
  "validation_commands": [
    "python3 -m ruff check --select E4,E7,E9,F,I,B,UP agent_control gate_control kernel_adoption_control programme_control standards_control tests/test_agent_control.py tests/test_check_adr_references.py tests/test_check_commit_identity.py tests/test_check_local_action_workspace.py tests/test_check_receipts.py tests/test_check_validation_contract.py tests/test_gate_control.py tests/test_kernel_adoption_control.py tests/test_kernel_adoption_runner.py tests/test_programme_control.py tests/test_standards_control.py tools/check_adr_references.py tools/check_commit_identity.py tools/check_local_action_workspace.py tools/kernel_adoption_observation.py tools/check_receipts.py tools/check_validation_contract.py tools/dotmac-agent tools/dotmac-gates tools/dotmac-programme tools/dotmac-standards",
    "python3 -m ruff format --check agent_control gate_control kernel_adoption_control programme_control standards_control tests/test_agent_control.py tests/test_check_adr_references.py tests/test_check_commit_identity.py tests/test_check_local_action_workspace.py tests/test_check_receipts.py tests/test_check_validation_contract.py tests/test_gate_control.py tests/test_kernel_adoption_control.py tests/test_kernel_adoption_runner.py tests/test_programme_control.py tests/test_standards_control.py tools/check_adr_references.py tools/check_commit_identity.py tools/check_local_action_workspace.py tools/kernel_adoption_observation.py tools/check_receipts.py tools/check_validation_contract.py tools/dotmac-agent tools/dotmac-gates tools/dotmac-programme tools/dotmac-standards",
    "python3 -m mypy --strict --scripts-are-modules agent_control gate_control kernel_adoption_control programme_control standards_control tools/check_adr_references.py tools/check_commit_identity.py tools/check_local_action_workspace.py tools/kernel_adoption_observation.py tools/check_receipts.py tools/check_validation_contract.py tools/dotmac-agent tools/dotmac-gates tools/dotmac-programme tools/dotmac-standards",
    "python3 tools/check_adrs.py",
    "python3 tools/check_adr_references.py",
    "python3 tools/check_commit_identity.py --base origin/main",
    "python3 tools/check_receipts.py --base origin/main",
    "python3 tools/check_local_action_workspace.py",
    "python3 tools/check_validation_contract.py",
    "python3 -m agent_control verify --root . --profile .dotmac/agent-profile.json",
    "python3 -m programme_control --root .",
    "python3 -m standards_control verify --root . --profile .dotmac/standards-profile.json --default-branch main"
  ],
  "allowed_surfaces": [
    "codex",
    "claude-code"
  ],
  "rollout": {
    "mode": "pilot",
    "managed_configuration": false,
    "authorized_endpoint_classes": [
      "developer-workstation",
      "ci-runner"
    ],
    "blocked_by": [
      "docs/open-decisions.md decision 5: human/agent identity separation",
      "docs/open-decisions.md decision 8: managed policy rollout and cutover"
    ]
  }
}
